<tid xmlns:xsi="http://www.w3.org/2001/XMLSchema-instance" xsi:noNamespaceSchemaLocation="tipiscript.xsd" errorhandler="error">
    <tipi name="init" id="init" class="frame" w="1024" title="&apos;NavajoDashboard&apos;" h="768" icon="{resource:/navajo-icon.png}" y="10" x="10">
        <tipi-instance id="tipi" class="tipi" background="{paint:/gradient-east-#FFFFFF-#AABBFF}">
            <event type="onInstantiate">
                <action type="performMethod">
                    <param name="password" value="{system:/navajopassword}"/>
                    <param name="destination" value="*"/>
                    <param name="fireevent" value="true"/>
                    <param name="hostUrl" value="{system:/navajoserver}"/>
                    <param name="breakOnError" value="false"/>
                    <param name="keystore" value=""/>
                    <param name="tipipath" value="{tipi:/.}"/>
                    <param name="username" value="{system:/navajouser}"/>
                    <param name="expirationInterval" value="-1"/>
                    <param name="method" value="&apos;InitNavajoStatus&apos;"/>
                    <param name="keypass" value=""/>
                </action>
                <action type="performMethod">
                    <param name="password" value="{system:/navajopassword}"/>
                    <param name="fireevent" value="true"/>
                    <param name="destination" value="*"/>
                    <param name="hostUrl" value="{system:/navajoserver}"/>
                    <param name="breakOnError" value="false"/>
                    <param name="keystore" value=""/>
                    <param name="tipipath" value="{tipi:/../..}"/>
                    <param name="username" value="{system:/navajouser}"/>
                    <param name="expirationInterval" value="-1"/>
                    <param name="keypass" value=""/>
                    <param name="method" value="&apos;InitGetAccessStatistics&apos;"/>
                </action>
                <action type="performMethod">
                    <param name="password" value="{system:/navajopassword}"/>
                    <param name="fireevent" value="true"/>
                    <param name="destination" value="*"/>
                    <param name="hostUrl" value="{system:/navajoserver}"/>
                    <param name="breakOnError" value="false"/>
                    <param name="keystore" value=""/>
                    <param name="tipipath" value="{tipi:/../..}"/>
                    <param name="username" value="{system:/navajouser}"/>
                    <param name="expirationInterval" value="-1"/>
                    <param name="keypass" value=""/>
                    <param name="method" value="&apos;InitGetAccessLogOverview&apos;"/>
                </action>
            </event>
            <layout type="border">
                <tipi-instance id="tabs" class="tabs" background="{paint:/gradient-west-#FFFFFF-#DDDDDD}" constraint="Center">
                    <tipi-instance id="userPanel" class="tipi" background="{paint:/gradient-west-#FFFFFF-#DDDDDD}" constraint="Webservices" service="InitNavajoStatus">
                        <event type="onLoad">
                            <block expression="{property:/./detailTabs/userDetails:.:/User/CurrentMap/Totaltime} != null">
                                <action type="setValue">
                                    <param name="to" value="{attributeref:/./detailTabs/userDetails/Totaltime:propertyValue}"/>
                                    <param name="from" value="&apos;&apos;"/>
                                </action>
                                <action type="setValue">
                                    <param name="to" value="{attributeref:/./detailTabs/userDetails/Datasource:propertyValue}"/>
                                    <param name="from" value="&apos;&apos;"/>
                                </action>
                                <action type="setValue">
                                    <param name="to" value="{attributeref:/./detailTabs/userDetails/DatabaseProductName:propertyValue}"/>
                                    <param name="from" value="&apos;&apos;"/>
                                </action>
                                <action type="setValue">
                                    <param name="to" value="{attributeref:/./detailTabs/userDetails/Map:propertyValue}"/>
                                    <param name="from" value="&apos;&apos;"/>
                                </action>
                                <action type="setValue">
                                    <param name="to" value="{attributeref:/./detailTabs/userDetails/DatabaseVersion:propertyValue}"/>
                                    <param name="from" value="&apos;&apos;"/>
                                </action>
                                <action type="setValue">
                                    <param name="to" value="{attributeref:/./detailTabs/queryTab/Query:text}"/>
                                    <param name="from" value="&apos;&apos;"/>
                                </action>
                                <action type="setValue">
                                    <param name="to" value="{attributeref:/./detailTabs/requestTab/Document:text}"/>
                                    <param name="from" value="&apos;&apos;"/>
                                </action>
                                <action type="setValue">
                                    <param name="to" value="{attributeref:/./detailTabs/responseTab/Document:text}"/>
                                    <param name="from" value="&apos;&apos;"/>
                                </action>
                                <action type="setValue">
                                    <param name="to" value="{attributeref:/./detailTabs/outStackTab/Stack:propertyValue}"/>
                                    <param name="from" value="&apos;&apos;"/>
                                </action>
                                <action type="setValue">
                                    <param name="to" value="{attributeref:/./detailTabs/objectStackTab/Stack:propertyValue}"/>
                                    <param name="from" value="&apos;&apos;"/>
                                </action>
                            </block>
                        </event>
                        <layout type="gridbag">
                            <tipi-instance id="userTable" class="tipitable" messagepath="&apos;/NavajoStatus/Kernel/Users&apos;" constraint="0,0,3,1,1.0,1.0,11,1,2,2,2,2,0,0">
                                <event type="onActionPerformed">
                                    <action type="setValue">
                                        <param name="to" value="{propertyref:/.:.:/AccessDetail/AccessId:propertyValue}"/>
                                        <param name="from" value="{property:/.:selectedMessage:AccessId}"/>
                                    </action>
                                    <block expression="{property:/./detailTabs/userDetails:.:/User/CurrentMap/Totaltime} != null">
                                        <action type="setValue">
                                            <param name="to" value="{attributeref:/../detailTabs/userDetails/Totaltime:propertyValue}"/>
                                            <param name="from" value="&apos;&apos;"/>
                                        </action>
                                        <action type="setValue">
                                            <param name="to" value="{attributeref:/../detailTabs/userDetails/Datasource:propertyValue}"/>
                                            <param name="from" value="&apos;&apos;"/>
                                        </action>
                                        <action type="setValue">
                                            <param name="to" value="{attributeref:/../detailTabs/userDetails/DatabaseProductName:propertyValue}"/>
                                            <param name="from" value="&apos;&apos;"/>
                                        </action>
                                        <action type="setValue">
                                            <param name="to" value="{attributeref:/../detailTabs/userDetails/Map:propertyValue}"/>
                                            <param name="from" value="&apos;&apos;"/>
                                        </action>
                                        <action type="setValue">
                                            <param name="to" value="{attributeref:/../detailTabs/userDetails/DatabaseVersion:propertyValue}"/>
                                            <param name="from" value="&apos;&apos;"/>
                                        </action>
                                        <action type="setValue">
                                            <param name="to" value="{attributeref:/../detailTabs/queryTab/Query:text}"/>
                                            <param name="from" value="&apos;&apos;"/>
                                        </action>
                                        <action type="setValue">
                                            <param name="to" value="{attributeref:/../detailTabs/requestTab/Document:text}"/>
                                            <param name="from" value="&apos;&apos;"/>
                                        </action>
                                        <action type="setValue">
                                            <param name="to" value="{attributeref:/../detailTabs/responseTab/Document:text}"/>
                                            <param name="from" value="&apos;&apos;"/>
                                        </action>
                                        <action type="setValue">